{
  "specversion": "1.0",
  "id": "019a3f10-2c80-7d41-b3a2-5e9c0a7f1d62",
  "source": "/disputedesk/api",
  "type": "disputedesk.dispute.status-changed.v1",
  "subject": "019a2a3c-7e40-7b11-8d2e-6a0f3c9e4d27",
  "time": "2026-10-30T09:41:12.654321Z",
  "datacontenttype": "application/json",
  "dataschema": "https://github.com/njabulozmnisi/disputedesk/blob/main/contracts/events/disputedesk.dispute.status-changed.v1.schema.json",
  "data": {
    "disputeId": "019a2a3c-7e40-7b11-8d2e-6a0f3c9e4d27",
    "fromStatus": "underReview",
    "toStatus": "resolved",
    "action": "resolve",
    "actorType": "operations",
    "outcome": "upheld",
    "occurredAt": "2026-10-30T09:41:12.654321Z",
    "disputeVersion": 3
  }
}
